{"$id":"https://jarvis-bridge/contract/v1/task-schema.json","$schema":"https://json-schema.org/draft/2020-12/schema","additionalProperties":true,"description":"Contract v1.0 — the JSON body of a [JARVIS-TASK] email. Validate before sending; the bridge rejects anything that fails this schema at intake.","properties":{"acceptance_criteria":{"description":"Discrete verifiable pass/fail statements, not one blob.","items":{"minLength":1,"type":"string"},"minItems":1,"type":"array"},"contract_version":{"description":"Contract version this task was written against, e.g. \"1.0\".","pattern":"^1\\.\\d+$","type":"string"},"created":{"description":"ISO-8601 UTC timestamp of composition.","format":"date-time","type":"string"},"do_not_touch":{"description":"Paths the executor must never modify. Always includes the bridge installation itself.","items":{"minLength":1,"type":"string"},"type":"array"},"executor":{"default":"cursor","description":"Which on-PC agent runs the task. Unknown values are rejected.","enum":["cursor","openclaw"],"type":"string"},"goal":{"description":"Full executor instructions. MUST end with the exact sentence 'Report back with the exact result subject: [JARVIS-RESULT] <task-id>.'","minLength":1,"pattern":"Report back with the exact result subject: \\[JARVIS-RESULT\\] [a-z0-9][a-z0-9-]*\\.$","type":"string"},"mode":{"description":"\"agent\" = full shell + file access (required for real work). Anything else is restricted.","enum":["agent","plan","ask"],"type":"string"},"report_back":{"description":"WHAT content to report. Never email-sending instructions; the bridge owns delivery.","minLength":1,"type":"string"},"screenshot":{"default":true,"description":"Attach a PNG screenshot as proof. False only for pure headless probes.","type":"boolean"},"task_id":{"description":"Unique id, lowercase letters/digits/hyphens. Echoed exactly in the result subject.","pattern":"^[a-z0-9][a-z0-9-]{0,63}$","type":"string"},"timeout_minutes":{"description":"Hard backstop for the run. Missing or out of range = intake rejection.","maximum":720,"minimum":1,"type":"integer"},"workspace":{"description":"Absolute working path on the target PC, namespaced under the bridge task area.","minLength":1,"type":"string"}},"required":["contract_version","task_id","workspace","goal","acceptance_criteria","mode","report_back","do_not_touch","created","timeout_minutes"],"title":"Jarvis Bridge task email body","type":"object"}